id,summary
361223680,"보령시(시장 김동일)는 지난 25일 나무섬 등 4개 도서 일원에서 특정도서 순찰 및 환경 정화활동을 실시했다고 26일 밝혔다.시는 특정도서의 경우 다양한 식물과 보호 야생동물, 해안 동·식물 등이 서식하고 있어 정기적인 순찰을 통한 도서 보호 활동을 이어나갈 계획으로, 이번 1차 환경정비에 이어 나머지 13개 도서에 대해서도 10월 중에 2차 환경 정화활동을 실시할 계획이다.신행철 환경보호과장은 ""최근 관광객들이 무인 도서를 찾는 경우가 많고 자연훼손의 우려가 높아 지속적으로 계도활동과 환경정화활동을 실시하여 관내 특정도서의 보존 가치를 높여나갈 계획이다""라고 말했다."
361234720,수원화성 동북포루(東北?樓)가 복원돼 본래 모습을 찾았다.'각건대'라는 별칭이 있다.화성 축성당시 각 시설물의 모습을 그리고 채색한 그림첩인 정리의궤는 동북포루를 원형에 가까운 모습으로 복원하는 데 큰 도움이 됐다.
361250838,"지난 14일 사우디의 정유시설 두 곳이 드론의 공격을 받아 화재가 발생했다.이슬람국가(IS)와의 전쟁으로 황폐화 된 시리아와 이라크 상공에는 8개 국가가 드론을 운용하고 있다.보고서에 따르면 중국은 이스라엘, 미국과 함께 드론의 최대 수출국으로, 세계 소형 드론 시장의 70%를 점유하고 있다."
361268052,"한샘이 물류서비스 시장에 진출하게 되면서 제조부터 물류까지 라스트마일 전반을 아우르는 경쟁력을 갖추게 됐다.이로써 그간 시공 전문업체였던 서비스원의 사업영역이 물류로 확대돼 전문성이 커졌고 가구, 인테리어 시장뿐만 아니라 급성장하고 있는 온라인 가구 시장에서의 경쟁력을 확보하게 됐다.아울러 모든 조립 배송ㆍ반품 서비스를 당일 고객의 입회 하에 현장에서 제공하는 등 고객 편의도 크게 개선하겠다는 방침이다."
361269343,"골드코스트 한인회전주환 회장으로 부터 감사장 수여 받아앞으로도 교육과 봉사활동이 함께하는 연수 프로그램을 지속적으로 진행하도록 노력하겠다.”라고 포부도 밝혔다.부산·경남의 종합병원과 노인전문 의료기관을 비롯, 특수학교와 재활의학과 공공의료를 담당하는 보건소등에서 전문 의료인들을 양성 배출하고 있다."
361269346,"10월 2일 오후 3시 박물관 앞 개막행사, 내년 2월 29일까지 부산대 박물관 기획전시실 전시맥켄지 가족은 일제강점기와 한국전쟁을 거쳐 1970년대까지 한국에 머물며 1만여 장의 사진과 필름을 남겼다.이번 특별 순회전을 통해 한국-호주 양국 관계의 근간을 보여주는 흥미로운 역사에 대한 연구가 더욱 활발히 이루어지기를 바란다”고 전했다."
361269785,기업 100곳 가운데 14곳은 쓰러지기 직전인 ‘한계기업’으로 분석됐다.이자보상배율이 2년 연속 1 미만인 기업 비중은 2017년 19.0%에서 지난해 20.4%로 커졌다.한계기업은 채무상환능력이 취약한 데다 저신용등급 또는 자본잠식 상태인 기업이 많아 경영 여건이 더 악화하면 부실위험이 급증한다고 한은은 지적했다.
361275666,"10월 4일까지 온라인에서만 예매프로모션 항공권 중 ‘FLY’는 부치는 짐이 없는 조건이기 때문에 자신의 여행일정과 계획에 적합한 지 판단한 후 예매해야 한다.제주항공은 또 왕복항공권의 운임(유류할증료·공항시설사용료 제외)이 20만 원 이상일 경우에 사용할 수 있는 2만~3만 원 할인쿠폰을 제공하며, 부산~싱가포르·다낭·타이베이 노선에서 ‘뉴 클래스’ 좌석 서비스를 이용할 때 결제 금액에 따라 3만 원에서 7만 원까지 할인을 받을 수 있는 쿠폰을 제공한다."
361277588,"'대한민국 테마여행 10선'금강백제권역(대전-공주-부여-익산)참가자에게는 맛집 식사(1회), 여행자 보험 가입, 금강백제권역 투어패스권(총 13개 명소 입장 가능) 제공 혜택과 투어종료 후 완주 인증서도 제공된다.한편, 역사미션 스토리 투어는 대한민국 테마10선 9권역 사업으로 지역관광 활성화를 위해 문화체육관광부에서 금강백제권역(대전-공주-부여-익산) 4개 지역을 선정해 운영하고 있는 프로그램이다."
361279179,"엄건섭 기자이진모 상면장은 ""나눔사랑을 지속적으로 실천하고 있는 연새장례식장과 협약이 맺어져 저비용으로 장례를 치를 수 있게 돼 수급자들의 고민을 덜 수 있게 됐다""고 말했다.사용자격 및 사용료, 사용방법은 ‘가평군 장사시설의 설치 및 관리조례’에 정하고 있으며, 법제처 국가법령정보센터 등에서 확인할 수 있다."
361291768,지홍구 기자경찰은 1990년 초에도 이씨를 조사했다.이씨가 구속된 이후 화성 살인사건은 이어지지 않다가 공교롭게도 그가 풀려난 지 7개월 뒤인 1990년 11월 15일 9차 사건이 일어났다.
361293889,다음달 2일 국토교통부를 시작으로 국회 국토교통위원회의 2019년 국정감사 일정이 본격화된다.산자중기위는 7일 산업부 에너지부문에 대한 국감을 진행한 후 11일 한국전력공사를 시작으로 한국수력원자력 및 한전발전 5개 자회사 등 8개 기관에 대한 국감을 진행한다.이런 가운데 국토위 일반 증인은 간사 간 협의가 좀처럼 접점을 찾지 못해 미정 상태다.
361296437,지방의원 의정비를 자치단체가 자율적으로 결정할 수 있게 한 첫 해인 올해 대구시의회와 경북도의회 의정비가 모두 인상된 것으로 나타났다.포항시의회가 1.7%로 인상율 폭이 가장 컸다.윤 의원은 “행안부는 과도하게 의정비를 인상한 경우 해당 자치단체의 재정 수준 등에 비춰 적절하게 산정이 됐는지 등을 철저히 분석해 향후 의정비가 국민의 눈높이에 맞게 결정될 수 있도록 적극적으로 관리·감독에 나서야 한다”고 강조했다.
361310088,"자유한국당은 ‘저스티스리그’를 출범하며 공정·정의 가치 경쟁의 본격적 시작을 알렸다.저스티스리그는 당 홈페이지에 온라인 불공정사례 신고 센터를 여는 한편 기업 채용, 대학입학 등 공정 현안 관련 현장 방문과 정책 토론회도 개최할 계획이다.정 공동위원장은 저스티스리그의 6대 과제로 △입시제도 △국가고시제도 △공기업·공공기관 충원 및 승진 △병역제도 △납세제도 △노조의 고용세습을 거론하며 “공정경쟁을 보장하는 방향으로 활동해 나가겠다”고 말했다."
361311839,"특허청-대전검찰청 공동브리핑이들 홈페이지나 매장 간판에도 태극기를 내걸거나 상품에 '메이드 인 코리아'(Made in Korea) 문구를 적어 넣기도 했다.천세창 특허청 차장은 ""외국계 유통기업이 더이상 국내 기업의 브랜드나 이미지를 이용해 제품을 판매할 수 없도록 한 사례""라고 설명했다."
361312404,"신규양수-영농병행 태양광 등 지역실정에 맞는 그린에너지 개발 추진성과 홍보 -그린에너지로 그리는 지역발전’이란 주제로 신규 양수발전소 지자체 자율유치 공모 성공사례와 영농병행 태양광, 새만금수상태양광, 염전활용 태양광사업 등 그린에너지 개발사례를 소개했다.이인식 한수원 그린에너지본부장은 “영농병행 태양광 사업은 기존 영농지에서 농작과 태양광발전을 동시에 함으로써 농가소득을 높이고 산림훼손도 전혀 없는 혁신적 방식으로 추진되고 있고, 염전활용 태양광사업은 염전업이 한계에 이르는 지역의 주민 주도 사업모델로 적극 권장될 수 있다”며 “한수원은 친환경 종합에너지기업으로서 다양한 지역실정에 맞는 그린에너지 사업을 통해 국가균형발전에 적극 참여하고 있다”고 소개했다."
361314558,부산의 대표 창업 지원기관인 부산경제진흥원이 10년간 2000개에 육박하는 창업 기업을 발굴한 것으로 나타났다.부산경제진흥원은 2015년 부산시 남구 부경대 용당캠퍼스 내에 80개실 규모의 부산창업지원센터를 조성해 150여 개 창업 기업에 공간을 무료로 제공하고 있다.창업 기업 '더 마마파파(THE MAMAPAPA)'가 개발한 24가지 기능을 갖춘 무중력 친환경 유닛 베개는 지난 8월 와디즈 사이트를 통해 펀딩을 마감한 결과 당초 목표 금액 100만원의 26배가 넘는 2602만원 펀딩을 성공시켰다.
361315690,"백용규 기자모바일 군산사랑상품권은 모바일 앱인 ‘지역 상품권 착(CHAK)'을 스마트폰에 설치한 뒤 계좌연결이나 무통장입금을 통해 구입할 수 있고, 가맹점에서 QR코드를 찍으면 간편하게 결제 가능하다김성우 시 지역경제과장은 “모바일상품권 확장을 위해 모바일 상품권 가맹점 확보와 모바일 상품권 결제시스템과 연계한 배달앱 구축 등 시민사랑을 지속적으로 받을 수 있도록 노력하겠다.”고 전했다."
361355170,"당정청, 소부장특별법으로 개정또 기반 기술 구축, 적시성 있는 재정 투입, 과감한 규제특례 등의 정책지원 제도화도 필요하다""고 강조했다.노 실장은 “한일 양국 간 우호협력 관계가 복원되게 강력하게 촉구하는 기조 하에 다양한 외교적인 노력을 병행하고 있다""고 했다."
361355547,"道, 유통체계 문제 원인으로 분석이에 도는 곤충산업 유통 분야의 문제점을 해결하기 위해 이달부터 3천만원의 사업비를 투입해 ‘곤충제품마케팅 지원사업’을 추진하고 있다.앞으로 곤충산업의 흐름을 예의주시해 발빠른 정책을 수립하겠다”고 말했다."
361412605,"독일계 특수 화학기업 랑세스가 다가오는 가을·겨울 시즌을 선도할 4대 가죽 트렌드를 27일 발표했다.흥미진진하고 열정적이면서도 공격적이지 않은 분홍색 계통의 '카바레(Cabaret)' 컬러가 대표적이다.랑세스는 컬러, 질감, 촉감 및 전반적인 외관 등 미래 트렌드를 반영한 다양한 피혁 패턴 컬렉션과 함께 피혁 제조사들이 실제 생산 공정에 새로운 트렌드를 반영할 수 있도록 제조법을 담은 디지털 레시피북도 제공한다."
361436353,지난 9월26일 서울 도곡동 남양유업 본사에서 남양유업 전국대리점협회 회장이 가짜뉴스에 대한 회사측의 적극적인 대응을 촉구하고 있다.이후 대리점 갑질 소문으로 인한 피해와 영업 고충 등에 관해 토론했다고 남양유업은 전했다.전국 1700여 개 남양유업 대리점 가운데 대부분이 소속돼있다.
361458971,"= '김태희 동생' 배우 이완이 22일 오후 서울 방이동 올림픽홀에서 열린 '2019 소리바다 베스트 케이뮤직 어워즈(2019 SORIBADA BEST K-MUSIC AWARDS, 2019 SOBA)' 블루카펫 행사에 참석해 포즈를 취하고 있다.안녕하세요.예식은 양가 부모님들과 두 사람의 뜻에 따라 가족과 친지, 가까운 지인들만을 모시고 뜻깊게 진행하게 되었습니다."
361462815,"회원 수 83만 명이 활동 중인 네이버 카페 '국대폰'이 애플의 신제품 아이폰11, 아이폰11 프로, 아이폰11 프로 맥스 3종의 효율 적인 구매방법을 제시했다.국대폰 관계자에 따르면 ""아이폰 시리즈는 워낙 가격 방어가 심한 라인업으로 이통 3사의 공시지원금이 타 제조사 신규 모델에 비해 현저히 낮게 책정된다. 특히, 이번 아이폰11 시리즈는 최근 국내에서 밀고있는 5G 모델이 아닌 LTE 모델로 출시되면서 앞서 출시 된 갤럭시S10 5G나 갤럭시노트10처럼 높은 지원금을 기대하기 어렵다"" 고 전했다.국대폰은 이번 아이폰11 사전예약 혜택으로 아이패드PRO 3세대, 아이패드9.7, 에어팟 2세대, 애플워치4, 10인치 태블릿PC, 2박 3일 제주도 왕복권 등 다양한 혜택을 내걸었으며 상위대리점을 통한 빠른 재고 수급을 약속했다."
361471747,김용판 전 서울경찰청장<사진>이 조국 법무부 장관이 자택 압수수색 당시 검사와 통화를 한 것에 대해 “삶겨진 소머리가 웃을만한 조로남불 행태”라고 강도높게 비판했다.조 장관이 밝힌 검찰개혁에 대해서는 “직접 경험한 바로도 틀린 말이 아니라고 생각한다.그런데도 문제가 있다는 듯이 언급된 것에 대해 유감을 표명한 것”이라고 말했다.
361515977,"국토교통부 시범사업 선정...2020년까지 구축예산 30억 전액 국비확보시는 충남도가 주관한 '지방하천 수문 자동화 시스템 구축사업' 선정을 위한 노력 끝에 지난해 도비 10억원을 지원받아 총 20억원을 확보, 지방하천을 대상으로 사업을 진행해 왔다.오세현 아산시장은 ""시민의 품에 아름다운 곡교천을 안겨주기 위해 부단히 노력 중인 물의 도시 아산이 재난분야 하천 관리의 신기원을 열게 됐다""며, ""하천 운영관리의 문제점을 개선하기 위한 기초지자체의 노력으로 국가를 선도하는 사업을 발굴해 추진하게 된 것에 의미가 크다""고 말했다."
361522533,"전국시·도의장협의회 통해 정부 건의외국의 사례처럼 지방투자촉진보조금에 대해 지자체의 산업특성과 환경에 따라 차별성을 부여할 수 있도록 현행제도의 개선이 필요하다는 것이다.배지숙 의장은 “올해 SK 하이닉스 반도체클러스터 사업부터 대규모 신규투자들이 또 다시 수도권에 집중되는 것을 볼 때, 현행 지방투자촉진보조금 제도가 지방을 살리고 지역경제에 활력을 불어넣기 위한 제 역할을 하고 있다고 보기는 어렵다”면서 “현행 매칭방식인 보조금은 지자체의 재원이 마련되어 있지 않으면 집행이 불가, 지자체의 기업 유치 노력에 비례해 지자체의 부담이 커지는 모순을 안고 있다”고 현행 제도의 문제점을 지적했다."
361529638,"'금융이력 부족자(Thin filer)'가 최근 4년 반 사이에 62만여명이 증가한 것으로 나타났다.2 1,076,486 1,610,22"
361530138,"다가올 클라우드 에지 컴퓨팅 시대에 대응, 중앙 시스템과 에지를 연결하는 '클라우드 에지 플랫폼 기술' 국산화가 시작됐다.대용량 데이터 처리, 산업용 사물인터넷(IoT) 기기 증가에 따른 데이터 폭증 등 중앙 클라우드 집중은 신속성 등에서 비효율적이다.에스피테크놀러지는 단순 연구개발(R&D)에 그치지 않도록 사업화도 동시 추진한다."
361533409,"광양시청 전경.지원 금액은 2016년도 이후 학자금 대출금의 올해 발생 이자 전액으로 한국장학재단 대출금 상환방식으로 이뤄지며 12월 중 지급되며, 한국장학재단 홈페이지에서 이자 상환처리 내용을 확인할 수 있다.김성수 교육보육과장은 “비싼 등록금과 학비 대출 이자로 학생들의 심적 부담 가중과 공부에만 집중할 수 없는 환경이 매우 안타깝다”며, “학자금 대출이자 지원으로 학생들의 경제적 부담이 조금이나마 줄어들기를 바란다”라고 말했다."
361539806,"양가람 기자같은 시각, ACC 하늘마당에서도 미화요원들이 쓰레기와 씨름하고 있었다.적극적으로 음주·흡연 및 쓰레기 투척 등을 단속할 권한은 전당(ACC) 측에 있다”고 말했다."
361543833,"경관위원회, 스카이라인 문제 제기앞서 제주도는 지난해 도시·건축공동위원회 회의를 열고 이도주공 2·3단지에 대해 고도제한을 완화(30m→42m)하는 안을 의결했다.당초 연면적 14만8605㎡ 규모로 계획됐다가 15만4297㎡로 확대 변경됐다."
361580215,더불어민주당이 내년 총선을 앞두고 온라인 불법 당원 모집에 대한 전수조사(全數調査)에 착수했다.이에 따라 권리당원의 표심이 경선 결과를 판가름하는 요인으로 떠오르면서 모집 경쟁이 어느 때보다 치열했고 그 과정에서 불·탈법 논란이 끊이지 않았다.따라서 불법 모집된 당원들은 경선에 참여할 수 없도록 자격을 박탈해야 마땅하다.
361580220,문화재청 ‘청년 유네스코 세계유산 지킴이’ 활동 … 전남대 이수민·김선찬·박혜민·임은교씨 ‘주먹밥’ 팀오월광주 문화유산의 주인은 바로 나라는 사명감으로 5·18을 알리고자 합니다.”굿즈 판매로 나온 수익금은 5·18기념재단에 기부할 예정이다.
361582769,"국제디스플레이계측위원회(ICDM)가 최근 삼성전자와 LG전자가 논쟁 중인 '8K 기술'에 대해 ""개입하지 않는다""며 한 발 물러났다.헬게 시첸 회장은 이와 관련한 언론 질의에 ""SID는 새로운 제품의 성능을 측정하기 위한 공인된 '글로벌 도구'를 제공하고 있다""며 ""디스플레이 기술의 한계를 넘으려는 삼성과 LG의 노력에 대해 기쁘게 생각한다""며 최근 논쟁에 대한 즉답을 피했다.최근 독일 베를린에서 열린 유럽최대 가전전시회 'IFA 2019' 에서 관람객들이 삼성전자의 QLED 8K TV를 살펴보고 있다."
361586811,"亞 투수 최초…평균자책점 2.321점대 평균자책점으로 사이영상 수상에 대한 기대를 모았던 류현진은 지난 8월24일 뉴욕 양키스(4.1이닝 7실점), 8월30일 애리조나 다이아몬드백스(4.2이닝 7실점)전에서 흔들리며 사이영상 예상 1위 자리를 제이콥 디그롬(뉴욕메츠)에게 넘겨줬다.그는 탈삼진과 투구 이닝에서 좋은 결과를 냈고, 두 항목이 중요하다고 생각한다""고 말했다."
361598480,"서울은 물론 광주, 인천 등 광역시를 중심으로 신축 아파트의 가격이 치솟고 있다.가장 주목받은 지역은 서울이다.지난 1999년 송파구에서 준공한 '문정푸르지오 1차' 아파트는 전용면적 78㎡가 지난해 7월 6억5000만원 수준에서 올 7월 7억5000만원으로 상승했고, 2000년에 준공한 '대치삼성1차' 아파트도 전용면적 85㎡ 실거래가격이 지난해 14억원 초반대에서 지난달 말 15억8500만원까지 상승했다."
361620038,"조승래 의원 교육부로부터 제출 받은 징계 현황 분석올 상반기 기준 음주운전은 97건이다.조승래 의원은 ""개정 윤창호법의 취지가 음주운전 근절에 있음에도 불구하고, 모범이 돼야할 선생님들의 음주운전이 여전히 많은 것은 문제""라며 ""아이들을 믿고 맡길 수 있도록 교원들에 대한 징계와 교육 강화를 검토할 필요가 있어 보인다""고 말했다."
361627264,미국 규제당국이 감사인의 독립성 규정을 위반한 혐의로 글로벌 최대 회계법인인 PwC에 대해 790만달러(한화 약 95억원)의 제재를 확정했다.다만 파트너직은 그대로 유지됐다.더 높은 수익을 내는 컨설팅업무를 놓치는 것이 두려워서 감사업무와 관련해 회계장부 또는 경영진에게 의견을 개진할 동기부여를 받지 못할 수 있다는 우려가 제기된 데 따른 것이다.
361650938,"농어촌 경제 활성화 위해 올해 20억 포함 누적기준 143억 원 지원이로써 서부발전은 2017년 ‘농어촌상생협력기금 제1호 출연기업’으로 출연기관 중 최고 금액인 53억 원을 지원한 바 있으며, 지난해 70억 원과 올해 20억원 을 포함해 누적 기준 총 143억 원을 농어촌에 지원하게 된다.협력재단 김순철 사무총장은 “기금출연 초기부터 농어촌 지원에 남다른 관심과 열정을 갖고 참여해온 서부발전에게 다시 한 번 감사하다”고 말하며, 농어촌과의 상생발전을 위해 재단 역시 최선을 다할 것을 다짐했다."
361650949,"남기찬 사장이 ‘제8회 대한민국 지식대상’에서 국무총리상을 수상 후 진영 행정안전부 장관과 사진촬영을 하고 있다.대한민국 지식대상은 행정안전부가 지식기반의 행정·경영문화 확산을 위해 행정·공공기관 및 민간기업의 우수사례를 발굴하여 수여하는 상으로, 2012년부터 매년 매일경제신문사와 공동으로 개최하고 있다.부산항만공사 남기찬 사장은 “이번 ‘제8회 대한민국 지식대상’국무총리상 수상은 실제 업무에서 지식경영을 실천하고 있는 공사 임직원 모두의 노력의 결과”라면서 “앞으로도 지식경영을 적극적으로 이행하여 글로벌 물류시장을 선도하는 일류 항만공기업으로 도약하는 데 최선을 다할 것”이라고 밝혔다."
361657816,"NHN티켓링크는 티켓포털 티켓링크에서 엔씨소프트가 10월 26일, 27일 양일간 개최하는 'FEVER FESTIVAL 2019(이하 피버페스티벌)'의 티켓을 단독으로 예매 오픈 한다고 30일 밝혔다.뮤직 페스티벌은 월드 챔피언십과 같은 장소에서 10월 27일 열린다.월드 챔피언십과 뮤직 페스티벌 티켓은 티켓링크 홈페이지와 모바일 앱에서 신용카드, 무통장입금, 페이코(PAYCO) 간편결제와 같은 다양한 방식으로 구매할 수 있다."
361658815,"A씨는 2016년 7월 11일 B 자동차 렌터카업체와 48개월 장기 임대차 계약을 맺었다.렌터카업체는 분쟁조정과정에서 공정거래위원회의 '자동차대여표준약관'에 따라 계약 당시 계약해제 및 해지, 중도해지수수료 규정을 포함한 약관을 소비자에게 제공했고 약관을 근거로 계약해지와 위약금을 청구했으므로 신청인의 요구를 수용하기 어렵다고 주장했다.A씨가 의료기관에서 치료 중 사망했고 통상 원인이 자살이 아닌 경우 사망자 책임을 묻기 어렵다는 것이 이유였다."
361683890,"레고코리아(LEGO Korea)는 30일 스타필드 고양에 위치한 공식 레고스토어에서 2019 하반기 레고스토어 멤버십 골드 회원을 대상으로 진행된 레고랜드 말레이시아 4인 여행권 경품 증정식(사진)을 진행했다고 이날 밝혔다.혜택으로 해외 레고랜드 4인 여행권 응모 기회, 한정판 크리스탈 기념패·텀블러, 다양한 공식 레고 행사 우선 참여권이 주어진다.레고스토어는 롯데월드몰 잠실, 롯데 영플라자 명동, 스타필드 고양, 현대백화점 판교, 롯데백화점 부산 서면, 현대백화점 대구, 롯데백화점 인천터미널 등 총 7곳에 위치해 있다."
361707338,"남양주종합촬영소가 문을 닫고, 본격 부산종합촬영소 시대가 문을 연다.2011년만 해도 기장군 일대에 스튜디오 6동과 부대 시설, 공연장, 관광호텔 등을 건설한다는 구상이었고, 사업비는 1차 569억여 원, 2차 1714억여 원을 투입한다는 계획을 세웠다.조영미 기자"
361715675,"장원석 기자인천시는 이에 발맞춰 오랜 염원인 열린 바다를 만들기 위해 대대적인 철거 계획을 세웠다.내년에 태어날 손자는 열린 바다를 평생 즐기는 해양도시 인천의 시민이 됐으면 한다""고 말했다."
361751700,"‘국내 최고 전력분석관’ 평가5년간의 현역 생활을 뒤로 하고 허 감독은 1996년 훈련지원요원으로 삼성에 입사했고, 1998년부터 전력분석을 담당하면서 국내 전력분석관 중 최고 전문가란 평가를 받았다.우리가 힘이 약할 때 강한 상대를 이기기 위한 전략 등 상황과 여건에 맞는 계획들을 세우기 위해 비시즌때 바삐 움직일 것”이라고 덧붙였다."
361767550,"과목선택부터 학생부전형까지 총 7종고등학교 생활과 진로설계 그리고 대학입학까지의 유의미한 정보를 세종시 학생들에게 맞춤형으로 제공할 수 있는 도움자료들이 제작돼 각 시기에 맞추어 배포되고 있다.'보인다! 시리즈'는 세종시 고등학생들에게 책자로 배부되었으며, 교육청 누리집 공지사항(1032번)에서도 PDF파일 형태로 내려받을 수 있다."
361779460,"롯데하이마트가 모바일 앱 내 테마관 '차세대 라이프스타일관'의 누적 고객 참여수가 오픈 1년 만에 400만 건을 돌파했다고 1일 밝혔다.고객들이 마음에 드는 콘텐츠에 '좋아요'를 누르거나, 댓글을 남긴 빈도도 각각 약 8배, 약 12배로 성장했다.롯데하이마트는 오픈 1주년을 기념해 차세대 라이프스타일관 모바일 앱에 게재된 인테리어 콘텐츠에 담긴 가전, 가구 등 연관 상품을 특가판매한다."
