id,summary
351801475,"'몽유도원도' 되찾기 위한 운동의 일환으로 진행또한 시상식 후에는 일본 텐리대학 중앙도서관에 소장중인 몽유도원도 반환을 위해 20폭의 흰 천위에 어린이작가들과 함께 염원을 적는 퍼포먼스가 펼쳐졌다.차상권 위원장은 ""이번 아동미술대회는 어린 학생들이 한국미술의 밝은 미래와 희망을 펼칠 수 있도록 전문미술인과 한자리에서 전시하여 아동들에 동기를 부여하고자 기획했다""며 ""몽유도원도가 세상 밖으로 나올 수 있도록 안견아동미술대회와 안견미술모색전은 협회의 행사로 시대에 부응하기 위해 새롭게 태어나고자 노력하고 있다""고 말했다."
351811657,"강화군은 최근 관내에서 야생진드기 매개 감염병인 중증열성혈소판감소증후군(SFTS) 확진자가 올해 처음으로 발생함에 따라 야외활동 시 진드기에 물리지 않도록 각별히 주의할 것을 당부하고 나섰다.예방수칙에는 야외활동 시 기피제 활용 및 피부노출 최소화, 외출 후 반드시 샤워 및 착용했던 옷 세탁 등이 있다.강화=김혁호 기자 kimhho2@kihoilbo.co.kr"
351814481,"송우초 4학년 2반 담임교사 송명희와 깨비 22명이 학생은 또 “우리나라가 가장 늦은 통일이라는 거 알고 계시죠?광주 송우초등학교 4학년2반 학생들이 역사적인 남북미 '판문점 회동'을 보고 통일의 염원을 담아 대통령에게 손편지를 쓰고, 힘모아 뮤직비디오까지 제작해 눈길을 끌고 있다."
351814742,"김정대 기자 뉴시스재판부는 “약 3년 동안 대학가 주변에서 젊은 여성 피해자들이 사는 집에 침입, 잠들어 있던 피해자들을 흉기로 위협해 성폭행하고 금품을 빼앗았다.엄중한 처벌을 통해 사회적 경각심을 일깨울 필요가 있는 점 등을 고려했다”며 형이 너무 무겁다는 김씨의 항소를 받아들이지 않았다."
351833043,"대전시가 예고되는 시내버스 노조 파업 관련 대응책 마련에 비상이 걸렸다.우선 파업에 참여하지 않는 시내버스 3개 업체(산호교통, 경익운수, 협진운수)와 조합원이 아닌 운수종사자는 정상 근무가 가능해 411대의 시내버스는 정상운행을 하게 된다.박 과장은 지난 2007년 대전 시내버스 파업 당시 비상수송대책 업무를 맡았었다."
351869978,"'주요 20개국(G20) 정상회의에서 문재인 대통령이 실종됐다' 등의 허위조작정보(가짜뉴스)에 대해 더불어민주당이 검찰에 고발하기로 했다.이는 최근 한 언론이 외교부 통계를 이용해 지난해 해외 이주 신고자수는 2200명으로 2016년 455명에서 2년 만에 약 5배가 됐고 경제적 상황 등으로 해외로 떠나는 한국인이 많다고 보도한 것을 인용했다.하지만 민 대변인은 ""그렇게 변명을 하면 김 여사 가슴에 단 브로치가 파란 나비에서 빨간 코끼리로 변하냐""고 주장했다."
351870833,"공항·송정리역 등 곳곳에 기념 조형물 등장광주시는 주요 경기시설과 선수촌, 외부 손님들이 광주에 첫 발을 내딛는 광주공항·광주송정역·광주역 등 22곳에 접형·다이빙·아티스틱·싱크로나이즈드 등 각 수영 종목을 귀여운 캐릭터로 표현한 기념 조형물을 설치해 대회 분위기 조성에 나서고 있다./정희윤 기자 star@namdonews.com"
351875251,"시의회 산건위 사업계획 동의안 상정시의회 산건위도 지역건설업계에 돌아갈 수 있는 혜택 등에 집중하겠다는 입장이다.또 부가가치유발 효과 1032억원, 소득유발 효과 777억원, 고용유발 효과는 2451억원에 달할 것으로 예상했다."
351875843,'농로 가로막은 캠핑카 비켜주지 않는다'며 항의 끝에 홧김 범행경찰 조사 결과 A씨는 자신의 논·밭을 오가는 농로 주변에 B씨가 캠핑카를 세워놓은 문제로 다투던 중 화를 참지 못하고 범행을 저지른 것으로 드러났다.경찰은 또 수사기록을 보강하는 대로 이날 A씨에 대한 구속영장을 신청할 방침이다.
351876256,이동환 한국치맥산업협회 수석부회장은 대구치맥페스티벌이 100년 축제로 남기 위해서는 관련 기업들이 하나로 뭉쳐야 가능하다고 강조했다.또 올해 처음 푸드파이터 경연대회인 ‘천하제일 치맥왕 선발대회’를 아프리카TV와 함께 진행한다고 했다.앞으로도 편의성과 서비스 향상을 통해 더 많은 관람객이 만족하는 축제가 될 수 있도록 노력하겠다”고 약속했다.
351890135,"'명소' 관람객 늘겠지만 자연훼손 우려...더 큰 문제는 공연장소와 안전문제다.예산은 5억 8,800만원이 투입된다."
351890170,장다원가족끼리 놀러 왔다는 한 피서객은 “워낙 캠핑을 좋아해서 가족끼리 야영장 같은 곳에 자주 오는데 되도록 여름에는 안 오려고 한다.동구청 관계자는 “텐트를 치고 전화번호를 받아 안내문을 걸고 나흘이 지나도 텐트를 철거하지 않으면 철거하라고 전화를 한다”며 “철거를 하지 않는 텐트에 대해서는 강제 철거한 뒤 관리실에 보관했다가 찾아가게 하고 있다”고 설명했다.
351903250,"김종완 기자분수대 바로 옆 소공연장에서 펼쳐지는 문화공연도 군민들을 일품공원으로 이끌고 있는 또 다른 요인이다.오는 10월까지 공연을 예고한 가운데 9월, 10월은 월 1회씩 공연을 진행할 계획이다."
351909935,"2019년 대한민국 녹색경영대상 개인부문에서 산업포장을 수상한 양우정 대흥산업 대표는 ""2000년대 이후 급격한 산업 발전과 함께 건설 분야 역시 무서운 속도로 발전하면서 구조물도 점차적으로 고층화·대형화되고 있다""고 말했다.양 대표는 ""건축구조물에 있어 누수는 사용자 거주에서의 불편함뿐만 아니라 구조물의 성능 저하와 가치 하락 및 신뢰성 저하 등 다양한 문제점을 야기한다""면서 ""지난 30년 동안의 노하우를 바탕으로 다양한 환경과 구조물에 적용 가능한 방수자재를 개발해 완전방수 기술을 실현하고자 끊임없이 노력했다""고 말했다.양 대표는 단열성능을 강화한 창호세트를 통해 녹색전문기업 인증을 획득했고, 오염물질 발생을 최소화한 제품을 생산해 친환경 경영을 펼치고 있다는 점이 좋은 평가를 받았다."
351910626,화순군청 배드민턴팀이 지난 1996년 창단 이후 24년만에 처음으로 메이저대회 정상을 밟았다.화순군청 배드민턴팀의 우승은 주목받고 있다.KGC인삼공사와 4강전에서 만난 화순군청은 게임스코어 3-1로 또다시 짜릿한 승리를 거머쥐었다.
351911392,"미국과 중국이 첨예하게 대립하는 최첨단 하이테크 산업에서 중국이 지난해 9개 분야의 시장 점유율을 확대한 것으로 조사됐다.차세대 통신인 5G 기술 개발에 주력한 화웨이는 휴대전화 기지국의 점유율은 30.9%로, 전년도보다 3.0% 포인트 더 늘려 선두를 유지했다.특히 알리바바는 음성인식 시스템의 정확도를 높여 일본 혼다 차량에 장착하려는 움직임도 있다고 이 매체는 전했다."
351918360,러시아에서 ‘新사회안전인프라분야 글로벌 캡스톤디자인’을 진행한 경일대 학생들이 현지 관계자들과 기념촬영을 하고 있다.러시아 소방 및 안전 분야에 대해 궁금한 사항을 피드백 받으면서 많은 경험을 하였다”고 말했다.한편 경일대는 러시아 국립소방대와 5년 전부터 소방방재학과 학생 연수 등의 학생교류를 해오다 소방 및 재난안전 분야에서 대학 차원의 학술교류 협력 확대를 위해 2017년 5월 교류협약을 체결했다.
351933586,대전시티즌이 이흥실 감독 부임 후 첫 경기에서 안양에 1-2로 패했다.(대전시티즌)26분에는 박수일의 왼쪽 측면패스를 박인혁이 발에 맞혔으나 골대를 넘겼다.이어지는 전남 원정경기에서 이 감독은 과연 어떤 비책을 내놓을까?
351964071,서천 군사(신청사)지구 도시개발사업 조감도.공공청사는 군청사와 119안전센터 3만 2606㎡가 예정됐다.공사는 도급공사비를 최대한 상계처리하고 도내 업체 참여비율 49% 이상(도 조례) 조건을 충족하는 업체를 대행개발사로 선정할 계획이다.
351976782,"LG전자가 트롬 의류건조기의 콘덴서(응축기) 자동세척 기능에 결함이 있다는 논란이 일자 10년간 무상보증 서비스를 제공하기로 했다.한편 지난 8일 청와대 국민청원 게시판에 '소비자 우롱하는 건조기 리콜 및 보상요청합니다'라는 제목으로 ""콘덴서 자동세척 시스템이 적용된 LG전자의 일부 건조기에서 악취가 나고 건조효율이 떨어지는 등의 문제가 있다""는 글이 올라왔다.기사 내용 관련 문의는 해당 언론사에 하시기 바랍니다."
351982506,"사용자 허가를 받지 않고 위치정보, 통화기록 등 개인정보를 마음대로 수집하는 안드로이드 애플리케이션(앱)이 1000여 개가 넘는 것으로 나타났다.다른 앱 위치 정보를 직접 가져오는 대신 장치가 연결된 와이파이(Wi-Fi)라우터 맥(MAC) 어드레스를 수집해 위치정보를 추론했다.불법 앱 운용자 또는 개인정보 불법 수집자에 대한 조치도 필요하다."
352009222,"세계적인 청과회사 돌(Dole) 코리아는 지난 3개월간 운영한 대학생 서포터즈 '아이돌스(I-Doles)' 3기 활동을 성황리에 종료했다고 9일 밝혔다.이번 활동 평가 결과 '돌(Dole)발상황'라는 참신한 주제로 돌 스위티오 바나나가 필요한 순간을 나타내는 홍보 영상을 제작한 2조가 1등을 차지했다.서포터즈 명인 아이돌스는 '나'를 뜻하는 'I'와 브랜드명 '돌(Dole)'을 조합한 단어로, '아이돌'이라는 단어의 젊고 신선한 이미지를 대학생 서포터즈 프로그램과 연결 지은 이름이다."
352018380,"성산읍반대대책위 등 반대단체 전략환경영향평가 부실 지적또 이들은 ""평가서 내 대안검토 중에서도 계획비교, 수단·방법, 입지조정 등 3가지를 선정해 계획의 적정성을 분석하고 있지만 형식적인 검토로 일관하고 있다""고 덧붙였다.강승준 온평리청년회장 등 비대위원 3명은 전략환경영향평가 초안 주민설명회 개최 중단을 촉구하며 삭발식을 벌이기도 했다."
352018394,"제주신보건강검진일, 여권만료일 등 맞춤형 개인 생활정보를 보여주는 '나의 생활정보 서비스'는 예비군훈련일, 국제운전면허, 주택연금정보 등 10종을 추가해 총 58종을 서비스한다.편리하며 안전한 로그인을 위해 지문보안인증방식을 도입했고, 민원수수료 등 결제를 위해 모바일 간편결제서비스를 도입했다."
352024778,"박상래 기자김완수 펭귄작가는 앞으로 세계최초로 '펭귄겨울축제'와 펭귄박물관 등 '펭귄테마파크'를 준비 중인데 그동안 수집한 펭귄아이템 3,120점과 남극10차 탐방하며 촬영한 사진 100,000여장과 비디오영상 1,000여개 등 펭귄콘텐츠의 모든 것을 '펭귄테마파크'에 기증할 예정이다.김작가는 ""남극점과 북극점, 자남극점 등 3극지점 탐방을 이미 끝냈고, 마지막인 '자북극점'까지 탐방해 세계최초로 4극지점을 끝내야 극지방 여행의 피날레를 장식해야 할 것 같다""고 말했다."
352025501,"뉴시스 편집에디터전국장애인차별철폐연대는 10일 “작품에서는 이 캐릭터가 말이 어눌하고 발음도 제대로 못하는 것은 물론, 생각하는 부분에서도 발음이 어눌하고 제대로 발음 못하는 것처럼 표현되고 있다.관련 소식을 접한 기안84 소속사 미스틱스토리 관계자는 “현재 사태를 파악하고 내부 정리 중”이라고 밝혔다."
352035624,"윤석열 검찰총장 후보자가 인사청문회에서 거짓 증언을 했다는 논란이 불거지면서 야권의 사퇴요구가 거세지고 있다.그러나 녹취 파일을 들이대자 윤 후보의 위증이 만천하에 드러났다”면서 “국회를 모욕하고, 국민을 모욕한 윤 후보자는 후보직에서 즉각 사퇴하라”고 주장했다.윤 후보자는 인사청문회에서 해당 변호사가 “선임되지는 않았다”고 주장했는데 선임계를 제출하고 변호인으로 활동했다는 관련 사건 판결문이 일부 매체를 통해 공개됐다."
352036832,"조직위, 남부대 국제수영장서 비상대피훈련수영대회 기간 중 경기장에서 발생할 수 있는 다양한 사고유형에 대한 대처능력 향상을 위해 진행된 이날 비상대피훈련은 실전을 방불케 했다./정희윤 기자 star@namdonews.com"
352052205,"백주희실질적으로 이 모델을 확산해 나가야 한다”고 강조했다.한편 이번 회의는 지난해 11월과 올해 1월에 열린 ‘공정경제 추진 전략회의’에 이어 세 번째 열리는 공정경제 관련 부처 회의로, 집권 중반기를 맞아 성과 창출에 집중하자는 취지에서 이름을 ‘성과보고 회의’로 변경한 것으로 전해졌다."
352074064,변호사 3명·7명은 대학생 “경기장·선수촌·날씨 원더풀”대표팀 매니저를 맡고있는 심펄링험(43)은 뉴질랜드 킹스칼리지(Kingscollege)에서 불어를 가르치른 교사다.뉴질랜드 수구대표팀은 오는 15일 오후 5시 50분 광주시 광산구 남부대 수구경기장에서 ‘강호’ 헝가리와 첫 경기를 갖는다.
352074104,"광주 경실련·여성단체연합 등이어 “2019년 7월 9일 현재 가습기 살균제로 인해 접수된 피해자만 6461명이고 공식적으로 신고된 사망자들만 1415명에 달한다”며 “피해자 보상 강화와 함께 범정부적 가습기살균제 피해 TF팀 구성·정례보고회 개최, 문재인 대통령이 참석하는 정부 차원의 피해자 추모 행사 개최 등 정부의 구체적이고 적극적인 노력이 필요하다”고 덧붙였다.순천이 33명(사망 11명)으로 가장 많았으며 광양 15명(5명), 여수 14명(7명), 목포시 10명(2명), 무안 10명(4명), 나주시 8명(5명), 장성 7명, 담양 6명, 화순 5명, 고흥 4명, 진도 3명, 함평 3명, 영광 3명, 영암 2명, 장흥 2명, 완도 2명, 보성 1명, 신안 1명, 강진 1명, 곡성 1명 순이다."
352074144,“한국도 불법 플라스틱 폐기물 밀반입의 피해 국가가 될 수 있다.” 화학·폐기물 관련 세계적인 전문가 중 하나인 조 디간지 아이펜(IPEN) 선임과학기술고문이 바젤협약 개정 이후 내린 진단이다.-187개국이 개정에 동의했다./중앙SUNDAY=배동주 기자
352110368,동국제약 서호영 상무(오른쪽에서 두번째)와 녹색어머니중앙회 천경숙 회장(왼쪽에서 세번째)을 비롯한 양측 관계자들이 '우리 아이 안전 캠페인' 후원 협약식에서 기념사진을 찍고 있다.협약식 행사에는 동국제약 서호영 상무와 녹색어머니중앙회 천경숙 회장 및 각 지역별 회장들을 비롯한 양측 관계자들이 참석했다.동국제약은 상처치료제 '마데카솔' 브랜드로 다양한 공익활동들을 펼쳐오고 있다.
352113224,"아우디폭스바겐코리아와 비영리단체(NPO) 파트너 한국사회투자가 서울특별시와 함께 '초록빛 꿈꾸는 통학로' 프로젝트 첫 번째 통학로 조성했다.서울 강동구 강명초중교 인근에 조성된 첫 번째 초록빛 꿈꾸는 통학로는 6차선 대로변 양측 총 길이 700m다.다양한 색감의 녹음과 무지개 콘셉트를 특징으로 교목과 관목, 지피 등 총 19종 6500여주를 식재했다."
352121753,침대 베개 등 침구류시장이 커지고 있다.일반적인 침구브랜드 매장은 개방형 공간이기 때문에 편하게 누워 체험하기 어렵다는 의견이 많았다.북촌 한옥마을에 있는 향수공방 '르네랩'은 이번 행사를 위해 팝업 스토어를 열고 향수 만들기 강좌를 진행한다.
352145535,15일부터 내달 2일까지 실시디지털 오디오 콘솔의 가장 큰 장점은 매 공연에 사용된 음향디자인을 저장할 수 있다.한편 개관 이래 처음으로 무대막도 전면 교체된다.
352167035,김명식 기자일본 요코하마 예술단은 젊은층에서부터 노년층까지 마치 대가족을 연상케하는 멤버로 구성된 K-one Dream팀이 무대에 오른다./김명식 기자 msk@namdonews.com
352172064,"중구선관위 의견 수렴·위원회 회의 거쳐 지난달 27일 결정선관위는 '공직선거법' 201조 1항 '선거일부터 임기만료일까지의 기간이 1년 미만이거나 지방의회 의원정수의 4분의 1 이상이 궐원(임기만료일까지의 기간이 1년 이상인 때에 재선거·연기된 선거 또는 재투표사유에 따른 경우는 제외)되지 않은 경우에는 보궐선거를 실시하지 않을 수 있다'고 명시한 법적 근거를 바탕으로 관계기관의 뜻과 해외연수에서 가이드를 폭행한 예천군의회 사례, 박 전 의원의 복직 가능성 등을 종합적으로 고려해 보궐선거를 치르지 않기로 최종 정했다.서명석 중구의회 의장은 기자와의 통화에서 ""용두·중촌동장을 했던 윤원옥 비례대표 의원도 있고 이정수 사회도시위원장도 있어 주민 심부름꾼 역할을 하는 데 지장이 없을 것으로 판단했다""며 ""최종 결정은 선관위가 내린 거고 의회는 민주적으로 의견을 모은 것뿐""이라고 전했다."
352179433,"사건 발생 10년 만에 열린 보육교사 살인사건에 대한 1심 선고가 11일 진행될 예정인 가운데 재판부가 어떤 결정을 내릴지 이목이 집중되고 있다.그러면서 검찰측은 ""미세섬유와 법의학, CCTV 영상, 과학기술 등을 토대로 도출한 증거를 토대로 볼 때 피고인이 범행이라는 것은 실체적 진실""이라며 ""범행 동기와 수법 등을 보면 피고인은 사회에서 격리시켜야 마땅하다""며 무기징역을 구형했다.반면 변호인측은 검찰이 제시한 증거가 모두 정황증거에 따른 추론인 만큼 박씨의 범행을 입증하기에는 부족하다고 지적하며 박씨가 무죄임을 주장했다."
352179622,"제주신보숙박업과 음식점의 휴폐업 속출, 렌터카 감축 등 관광관련 뉴스는 대부분 좋지 않은 소식이 들려온다.지속적인 인프라 확충 및 개선과 안전한 사회, 친절, 질서, 청결을 기본으로 한 서비스품질 개선이 있어야 한다."
352179840,"제주신보나는 물건을 사지도 않았고 그런 카드도 없다고 하니, 누군가 내 개인 정보로 카드를 만들어 사용한 모양이라 하질 않는가.무더위가 코앞이다."
352192323,"지난해 열린 2018 부산국제광고제 행사 모습.이 밖에 뉴트로 트렌드를 반영한 작품들과 가상현실(VR), 혼합현실(MR), 인공지능(AI) 등 최첨단 기술과 융합된 작품들이 다수 출품돼 진화하고 있는 광고업계의 모습을 엿볼 수 있었다.오는 8월 22일부터 3일간 부산 벡스코에서 열리는 부산국제광고제 행사장에서 만나볼 수 있다."
352201287,잠원동 건물붕괴로 시민 불안↑철거가 한창인 도마동의 한 재개발 사업장.현행법 상 건축물 철거는 관할청에 해체공사 계획서를 신고 후 철거 건물 심의에서 안전 요건을 충족하는지 여부만 확인할 분 철거 현장을 관리·감독할 의무가 없다.
352202789,정희윤 기자이와함께 5·18 역사왜곡 처벌과 진상규명을 위해 활동하고 있는 5·18역사왜곡처벌운동본부에도 1천638만원을 기부한다./정희윤 기자 star@namdonews.com
352239060,#.경북도청 신도시에 거주하는 김모씨(여·30).도청신도시 연령별 인구 구성비를 봤을 때 소아청소년과와 산부인과의 개원이 시급한 셈이다.다만 의사 입장에서는 수익을 위해선 더 많은 인구가 있어야 하기 때문에 병원 유치에 어려움이 많다”고 설명했다.
352242611,"홍상훈 주임(오른쪽)이 동부경찰서 직원으로부터 전화금융사기 유공으로 감사장을 받고 기념촬영을 하고 있다.그 결과, 02로 시작되는 번호와 발신번호표시제한 등의 목록이 있는 것을 확인하고서야 A씨가 보이스피싱에 속아 돈을 찾으려 했다는 것을 밝혀냈다.동부경찰서는 최근 홍 주임에게 전화금융사기 유공으로 경찰서장 명의 감사장과 소정의 선물을 전달했다."
352271917,"5개 분야 13개 과목 240명 수료, 문화·인문 감각 키워, 2학기 프로그램 확대·강화RC 프로그램은 대학 기숙사에 정주하는 학생들이 인문·문화·체육 등 다양한 활동에 참여하는 기회를 마련해 학업과 생활을 통합하고 주체적인 삶을 설계하는 데 도움을 주기 위해 마련한 비교과 교육과정이다.RC에 참여한 학생들은 주 1회 참여를 통해 요가와 탁구, 테니스, 기타, 드럼, 네일아트 등 다양한 체육·문화 활동을 펼쳤으며, 독서 토론회 등을 통해 인문학적 감각을 높이는 기회를 얻었다."
352281684,"올해 창립 20주년을 맞은 한경희생활과학이 '사물인터넷(IoT) 플랫폼' 기업으로 대변신을 꾀한다.네이버 인공지능(AI) 스피커 '클로바'와 곧바로 연결해 사용할 수 있다.한 대표는 ""한경희스마트홈은 IoT가 멀고 어렵게 느끼는 사람도 간편하게 스마트홈을 구축해 편리한 생활을 할 수 있을 것""이라고 강조했다."
352288549,"반려동물 증가와 함께 관리소홀로 인한 인명사고 지속적으로 발생하면서 사회문제로 야기되고 있다.변경 신고 대상은 등록대상 동물의 유실·죽음, 소유자 변경, 소유자 주소, 전화번호, 무선식별장치 분실 등에 따른 재발급 등이다.특히 제주도는 오는 9월부터 미등록, 변경사항 미신고 등에 대한 집중 단속을 실시해 과태료를 부과할 계획이다."
352301567,"옷감형 유연구동기를 이용한 의복형 웨어러블 로봇.유연구동기와 배터리, 제어기 등을 모두 포함한 의복형 웨어러블 로봇의 무게는 약 1kg으로, 일반 성인이 입는 점퍼 수준이다.박철훈 책임연구원은 ""의복형 웨어러블 로봇은 택배, 물류 등 신체일부분을 반복적으로 사용하는 분야의 작업환경을 개선할 수 있고 향후 고령화 시대의 노동인력 감소 문제를 해결할 수 있는 좋은 대안""이라며 ""저렴하고 편안한 웨어러블 로봇으로 대중화에 성공해 해외시장을 선점할 수 있도록 노력하겠다""고 말했다."
352315313,"- 내 집 앞, 내 마을 청결은 내가 지킨다이로 인해 작년 12월 말 기준 전국에 131만2026톤의 쓰레기가 불법으로 버려지면서 쓰레기 불법투기가 심각한 사회 문제로 떠오르고 있다.조길형 충주시장은 ""오늘 선포식을 시작으로 폐기물 불법투기를 막기 위해 주민 감시활동을 비롯한 각종 활동을 전개할 것""이며, ""내 집 앞·내 마을 청결활동에 선제적으로 대응하기 위해 충주시민 분들의 많은 관심과 협조를 부탁드린다""고 말했다."
352340261,"회삿돈을 횡령하고 직원들에게 거짓 증언을 시킨 혐의 등으로 기소된 김도균(49) 탐앤탐스 대표에게 법원이 징역형 집행유예를 선고했다.김 대표는 허위 세금계산서 관련 세무조사를 받게 되자 자신의 형사 책임을 대신 지도록 임원들에게 허위자백을 하게 한 후 벌금형이 나오자 자회사 계좌에서 벌금을 대납하게 한 것으로도 파악됐다.또 특정범죄가중처벌법 위반(허위세금계산서 교부)은 2008년 전자세금계산서 도입에 따라 바뀐 제도에 따르면 처벌할 수 없고, 공소시효도 이미 지났다고 판단했다."
352344340,우편 설문조사 결과 응답자 84% 철거 희망당초 이번 설문조사 결과를 토대로 옛 성산교회 건물의 철거 여부를 결정하려 한 만큼 대전시는 앞으로 철거를 위한 행정 수순을 밟을 것으로 보인다.시는 앞으로 중구와의 협의를 거쳐 사안을 진행할 계획이다.
352346170,"학교 측 ""무단 침입했지만 문제지 유출 없었다, 징계 규정과 절차대로 했다"" 박동민 기자 카이스트(KAIST) 부설 한국과학영재학교에서 한 학생이 기말고사를 앞두고 시험문제지 보관장소에 침입한 사실이 뒤늦게 드러났다.학교 측은 두 차례 무단침입만 했을 뿐 시험문제지는 유출되지 않았다고 밝혔다.부산 부산진구 당감도에 있는 한국과학영재학교는 2003년 영재학교로 출범해 2009년 KAIST 부설 학교로 지정된 미래창조과학부 소속 과학영재학교다."
